<?xml version="1.0" encoding="UTF-8"?> 
<employees xmlns="http://www.zsk.ict.pwr.wroc.pl/zsk/dyd/did/java_xml/laboratory/lab_3/" 
xmlns:xsi="http://www.w3.org/2001/XMLSchema-instance" 
xsi:schemaLocation="./l3t1.xsd"> 
	<employee>	 
		<name>Jan</name>
		<name>Grześ</name> 
		<state>unborn</state>
		<surname>Nowak</surname>   
		<phone operator="PLAY">600613</phone>
		<address type="temporary">
			<street lang="pl">ul. Ulicowa</street>
			<city>Wrocław</city> 
			<country>Poland</country>
			<gps coordinates-system="EPEG600613">51,17</gps>      
		</address> 
	</employee>
	<employee> 
		<name>Juan</name>
		<surname>Carlos</surname>
		<surname>De Los Parlotes</surname>   
		<surname>De Amadeo</surname>
		<phone operator="UKMOBILE" countryprefix="+44">564785634</phone>       
		<address type="permanent residence">
			<street lang="es">Calle de la Madera</street>
			<street lang="pl">ul. Drewniana</street>
			<city lang="es">Madrid</city>
			<city lang="pl">Madryt</city>
			<country lang="es">Espana</country>
			<country lang="pl">Hiszpania</country>
			<country lang="en">Spain</country>
			<gps coordinates-system="EEPG4654">40.4235066,-3.7043417</gps>
		</address>

	</employee>
</employees>   